{
  "ecosystem_stats": {
    "total_concepts": 7,
    "active_concepts": 7,
    "high_quality_concepts": 6,
    "mid_quality_concepts": 1,
    "refinement_queue_size": 0,
    "merged_concepts": 0,
    "conceptual_diversity": 2.521640636343318,
    "relation_count": 0,
    "contradiction_count": 0,
    "quality_score": 0.9692857142857143,
    "refinement_success_rate": 0.0
  },
  "concepts": [
    {
      "id": "consciousness-high",
      "label": "Consciousness",
      "definition_full": "Consciousness is the subjective experience of being aware and having phenomenal states. It involves the integration of sensory information with memory, attention, and cognitive processes to create a unified first-person perspective of reality.",
      "source_evidence": "notes: Extracted from comprehensive philosophical analysis | source: Stanford Encyclopedia of Philosophy | extraction_date: 2025-09-15T10:00:00",
      "lineage": [],
      "generation": 0,
      "state": "HIGH_QUALITY",
      "quality_tier": "HIGH",
      "refinement_priority": "MEDIUM",
      "relations": [],
      "contradictions": [],
      "metrics": {
        "support_strength": 0.9,
        "definition_completeness": 1.0,
        "refinement_potential": 0.0,
        "evidence_strength": 1.0,
        "merge_count": 0,
        "refinement_attempts": 0,
        "successful_refinements": 0
      },
      "refinement_history": [],
      "timestamp": "2025-09-15T10:00:00"
    },
    {
      "id": "recursion-mid",
      "label": "Recursion",
      "definition_full": "A process that calls itself with different parameters, enabling infinite generation from finite rules.",
      "source_evidence": "notes: Basic definition from computer science context | source: Programming textbook chapter 5",
      "lineage": [],
      "generation": 0,
      "state": "HIGH_QUALITY",
      "quality_tier": "HIGH",
      "refinement_priority": "MEDIUM",
      "relations": [],
      "contradictions": [],
      "metrics": {
        "support_strength": 0.6,
        "definition_completeness": 1.0,
        "refinement_potential": 0.0,
        "evidence_strength": 0.85,
        "merge_count": 0,
        "refinement_attempts": 0,
        "successful_refinements": 0
      },
      "refinement_history": [],
      "timestamp": "2025-09-15T09:59:47.129961"
    },
    {
      "id": "emergence-low",
      "label": "Emergence",
      "definition_full": "Properties arising from interactions.",
      "source_evidence": "notes: Fragment from larger text",
      "lineage": [],
      "generation": 0,
      "state": "MID_QUALITY",
      "quality_tier": "MID",
      "refinement_priority": "MEDIUM",
      "relations": [],
      "contradictions": [],
      "metrics": {
        "support_strength": 0.4,
        "definition_completeness": 0.785,
        "refinement_potential": 0.13437499999999997,
        "evidence_strength": 0.625,
        "merge_count": 0,
        "refinement_attempts": 0,
        "successful_refinements": 0
      },
      "refinement_history": [],
      "timestamp": "2025-09-15T09:59:47.130960"
    },
    {
      "id": "systems-closed",
      "label": "Systems",
      "definition_full": "Systems are closed structures that maintain stability through rigid boundaries and controlled inputs.",
      "source_evidence": "source: Classical systems theory",
      "lineage": [],
      "generation": 0,
      "state": "HIGH_QUALITY",
      "quality_tier": "HIGH",
      "refinement_priority": "MEDIUM",
      "relations": [],
      "contradictions": [],
      "metrics": {
        "support_strength": 0.7,
        "definition_completeness": 1.0,
        "refinement_potential": 0.0,
        "evidence_strength": 0.625,
        "merge_count": 0,
        "refinement_attempts": 0,
        "successful_refinements": 0
      },
      "refinement_history": [],
      "timestamp": "2025-09-15T09:59:47.131929"
    },
    {
      "id": "systems-open",
      "label": "Systems",
      "definition_full": "Systems are open networks that evolve through dynamic interactions with their environment.",
      "source_evidence": "source: Modern complexity theory",
      "lineage": [],
      "generation": 0,
      "state": "HIGH_QUALITY",
      "quality_tier": "HIGH",
      "refinement_priority": "MEDIUM",
      "relations": [],
      "contradictions": [],
      "metrics": {
        "support_strength": 0.7,
        "definition_completeness": 1.0,
        "refinement_potential": 0.0,
        "evidence_strength": 0.625,
        "merge_count": 0,
        "refinement_attempts": 0,
        "successful_refinements": 0
      },
      "refinement_history": [],
      "timestamp": "2025-09-15T09:59:47.132929"
    },
    {
      "id": "awareness-duplicate",
      "label": "Awareness",
      "definition_full": "Consciousness involves the subjective experience of being aware and having phenomenal states through cognitive integration.",
      "source_evidence": "source: Cognitive science handbook",
      "lineage": [],
      "generation": 0,
      "state": "HIGH_QUALITY",
      "quality_tier": "HIGH",
      "refinement_priority": "MEDIUM",
      "relations": [],
      "contradictions": [],
      "metrics": {
        "support_strength": 0.8,
        "definition_completeness": 1.0,
        "refinement_potential": 0.0,
        "evidence_strength": 0.625,
        "merge_count": 0,
        "refinement_attempts": 0,
        "successful_refinements": 0
      },
      "refinement_history": [],
      "timestamp": "2025-09-15T09:59:47.133929"
    },
    {
      "id": "autopoiesis-mid",
      "label": "Autopoiesis",
      "definition_full": "Self-creating systems that maintain their organization through continuous regeneration of components.",
      "source_evidence": "source: Maturana and Varela foundational work",
      "lineage": [],
      "generation": 0,
      "state": "HIGH_QUALITY",
      "quality_tier": "HIGH",
      "refinement_priority": "MEDIUM",
      "relations": [],
      "contradictions": [],
      "metrics": {
        "support_strength": 0.65,
        "definition_completeness": 1.0,
        "refinement_potential": 0.0,
        "evidence_strength": 0.625,
        "merge_count": 0,
        "refinement_attempts": 0,
        "successful_refinements": 0
      },
      "refinement_history": [],
      "timestamp": "2025-09-15T09:59:47.135928"
    }
  ],
  "evolution_log": [],
  "refinement_queue": [],
  "quality_thresholds": {
    "high_quality_threshold": 0.8,
    "mid_quality_threshold": 0.4,
    "refinement_threshold": 0.3,
    "discard_threshold": 0.15,
    "adaptive_length_minimum": 20,
    "evidence_strength_weight": 0.3,
    "completeness_weight": 0.5,
    "support_strength_weight": 0.2
  }
}